{
  "$schema": "https://json-schema.org/draft/2020-12/schema",
  "$id": "https://github.com/agent-memory-skill/agent-memory-skill/schemas/state.schema.json",
  "title": "Agent Memory State",
  "type": "object",
  "required": [
    "version",
    "updated_at",
    "user_profile",
    "project",
    "threads",
    "decisions",
    "episodes",
    "migration"
  ],
  "properties": {
    "version": {
      "type": "integer",
      "minimum": 1
    },
    "revision": {
      "type": "integer",
      "minimum": 0
    },
    "updated_at": {
      "type": "string"
    },
    "user_profile": {
      "type": "object",
      "required": [
        "preferences",
        "working_style",
        "avoid"
      ],
      "properties": {
        "preferences": {
          "type": "array",
          "items": {
            "$ref": "#/$defs/record"
          }
        },
        "working_style": {
          "type": "array",
          "items": {
            "$ref": "#/$defs/record"
          }
        },
        "avoid": {
          "type": "array",
          "items": {
            "$ref": "#/$defs/record"
          }
        }
      },
      "additionalProperties": true
    },
    "project": {
      "type": "object",
      "required": [
        "name",
        "objective",
        "facts",
        "artifacts"
      ],
      "properties": {
        "name": {
          "type": "string"
        },
        "objective": {
          "type": "string"
        },
        "facts": {
          "type": "array",
          "items": {
            "$ref": "#/$defs/record"
          }
        },
        "artifacts": {
          "type": "array",
          "items": {
            "$ref": "#/$defs/record"
          }
        }
      },
      "additionalProperties": true
    },
    "threads": {
      "type": "object",
      "required": [
        "active",
        "open",
        "parked",
        "closed_recently"
      ],
      "properties": {
        "active": {
          "anyOf": [
            {
              "$ref": "#/$defs/record"
            },
            {
              "type": "null"
            }
          ]
        },
        "open": {
          "type": "array",
          "items": {
            "$ref": "#/$defs/record"
          }
        },
        "parked": {
          "type": "array",
          "items": {
            "$ref": "#/$defs/record"
          }
        },
        "closed_recently": {
          "type": "array",
          "items": {
            "$ref": "#/$defs/record"
          }
        }
      },
      "additionalProperties": true
    },
    "decisions": {
      "type": "array",
      "items": {
        "$ref": "#/$defs/record"
      }
    },
    "episodes": {
      "type": "array",
      "items": {
        "$ref": "#/$defs/record"
      }
    },
    "migration": {
      "type": "object",
      "required": [
        "summary",
        "next_actions",
        "risks",
        "handoff_notes"
      ],
      "properties": {
        "summary": {
          "type": "string"
        },
        "next_actions": {
          "type": "array",
          "items": {
            "type": "string"
          }
        },
        "risks": {
          "type": "array",
          "items": {
            "type": "string"
          }
        },
        "handoff_notes": {
          "type": "array",
          "items": {
            "type": "string"
          }
        }
      },
      "additionalProperties": true
    }
  },
  "$defs": {
    "record": {
      "type": "object",
      "required": [
        "id",
        "text",
        "status",
        "confidence",
        "salience"
      ],
      "properties": {
        "id": {
          "type": "string",
          "minLength": 1
        },
        "text": {
          "type": "string"
        },
        "type": {
          "type": "string"
        },
        "status": {
          "type": "string",
          "enum": [
            "active",
            "tentative",
            "candidate",
            "superseded",
            "stale",
            "closed",
            "parked"
          ]
        },
        "created_at": {
          "type": "string"
        },
        "updated_at": {
          "type": "string"
        },
        "confidence": {
          "type": "string",
          "enum": [
            "low",
            "medium",
            "high"
          ]
        },
        "salience": {
          "type": "integer",
          "minimum": 1,
          "maximum": 5
        },
        "evidence": {
          "type": "string"
        },
        "source": {
          "type": "string",
          "enum": [
            "agent",
            "derived",
            "external",
            "system",
            "tool",
            "user"
          ]
        },
        "scope": {
          "type": "string",
          "enum": [
            "agent",
            "global",
            "organization",
            "project",
            "role",
            "user"
          ]
        },
        "expires_at": {
          "type": "string"
        },
        "supersedes": {
          "type": "array",
          "items": {
            "type": "string"
          }
        },
        "tags": {
          "type": "array",
          "items": {
            "type": "string"
          }
        }
      },
      "additionalProperties": true
    }
  },
  "additionalProperties": true
}
